{
	"$schema": "schema/block_rotation.schema.json",
	"format": 2,
	"minecraft": "26.50",
	"about": "How each shape family that turns is turned: the name of a state in state_rotations.json, or a table of its own from value to Minecraft's turn.",
	"families": {
		"activator_rail": {"0": [0, 0, 0], "1": [0, 270, 0], "2": [0, 270, 315], "3": [0, 270, 45], "4": [315, 0, 0], "5": [45, 0, 0]},
		"amethyst": {"up": [0, 0, 0], "down": [180, 0, 0], "north": [90, 0, 0], "south": [270, 0, 0], "west": [0, 0, 270], "east": [0, 0, 90]},
		"anvil": "minecraft:cardinal_direction",
		"barrel": "facing_direction",
		"bed": "direction",
		"bell": "direction",
		"big_dripleaf": "minecraft:cardinal_direction",
		"button": {"1": [0, 0, 0], "0": [180, 0, 0], "2": [90, 0, 0], "3": [270, 0, 0], "4": [270, 270, 0], "5": [270, 90, 0]},
		"calibrated_sculk_sensor": "minecraft:cardinal_direction",
		"campfire": "minecraft:cardinal_direction",
		"carved_pumpkin": "minecraft:cardinal_direction",
		"chain": {"x": [0, 0, 270], "y": [0, 0, 0], "z": [90, 0, 0]},
		"chain_command_block": "facing_direction",
		"chest": "minecraft:cardinal_direction",
		"chipped_anvil": "minecraft:cardinal_direction",
		"chiseled_bookshelf": "direction",
		"cocoa": {"0": [0, 0, 0], "1": [0, 270, 0], "2": [0, 180, 0], "3": [0, 90, 0]},
		"command_block": "facing_direction",
		"comparator": "minecraft:cardinal_direction",
		"comparator_on": "minecraft:cardinal_direction",
		"copper_golem_statue": "minecraft:cardinal_direction",
		"coral_fan": {"0": [0, 0, 0], "1": [0, 270, 0]},
		"coral_fan_wall": {"0": [0, 90, 0], "1": [0, 270, 0], "2": [0, 0, 0], "3": [0, 180, 0]},
		"cube": {"north_up": [0, 0, 0], "west_up": [0, 90, 0], "south_up": [0, 180, 0], "east_up": [0, 270, 0], "up_north": [270, 0, 0], "up_south": [90, 0, 180], "up_west": [0, 90, 90], "up_east": [0, 270, 270], "down_north": [90, 0, 0], "down_south": [90, 180, 0], "down_east": [0, 270, 90], "down_west": [0, 90, 270], "1": [0, 0, 0], "x": [0, 0, 270], "y": [0, 0, 0], "z": [90, 0, 0]},
		"damaged_anvil": "minecraft:cardinal_direction",
		"decorated_pot": "direction",
		"detector_rail": {"0": [0, 0, 0], "1": [0, 270, 0], "2": [0, 270, 315], "3": [0, 270, 45], "4": [315, 0, 0], "5": [45, 0, 0]},
		"dispenser": {"0": [90, 180, 0], "1": [90, 0, 180], "2": [0, 0, 0], "3": [0, 180, 0], "4": [0, 90, 0], "5": [0, 270, 0]},
		"dried_ghast": "minecraft:cardinal_direction",
		"end_rod": {"0": [90, 0, 0], "1": [270, 0, 0], "2": [180, 0, 0], "3": [0, 0, 0], "4": [270, 0, 90], "5": [270, 0, 270]},
		"exposed_copper_golem_statue": "minecraft:cardinal_direction",
		"fence_gate": "minecraft:cardinal_direction",
		"flowerbed": "minecraft:cardinal_direction",
		"frame": "facing_direction",
		"furnace": "minecraft:cardinal_direction",
		"glazed_terracotta": {"0": [270, 0, 0], "1": [270, 0, 0], "2": [0, 0, 0], "3": [0, 180, 0], "4": [0, 90, 0], "5": [0, 270, 0]},
		"glow_frame": "facing_direction",
		"golden_rail": {"0": [0, 0, 0], "1": [0, 270, 0], "2": [0, 270, 315], "3": [0, 270, 45], "4": [315, 0, 0], "5": [45, 0, 0]},
		"grindstone": "direction",
		"hanging_sign": {"0": [0, 180.0, 0], "1": [0, 157.5, 0], "2": [0, 135.0, 0], "3": [0, 112.5, 0], "4": [0, 90.0, 0], "5": [0, 67.5, 0], "6": [0, 45.0, 0], "7": [0, 22.5, 0], "8": [0, 0.0, 0], "9": [0, 337.5, 0], "10": [0, 315.0, 0], "11": [0, 292.5, 0], "12": [0, 270.0, 0], "13": [0, 247.5, 0], "14": [0, 225.0, 0], "15": [0, 202.5, 0], "0-1:0": [0, 0, 0], "0-1:1": [0, 0, 0], "0-1:2": [0, 0, 0], "0-1:3": [0, 180, 0], "0-1:4": [0, 90, 0], "0-1:5": [0, 270, 0], "0-0:0": [0, 0, 0], "0-0:1": [0, 0, 0], "0-0:2": [0, 0, 0], "0-0:3": [0, 180, 0], "0-0:4": [0, 90, 0], "0-0:5": [0, 270, 0], "1-0:0": [0, 0, 0], "1-0:1": [0, 0, 0], "1-0:2": [0, 0, 0], "1-0:3": [0, 180, 0], "1-0:4": [0, 90, 0], "1-0:5": [0, 270, 0], "default:0": [0, 0, 0], "default:1": [0, 0, 0], "default:2": [0, 0, 0], "default:3": [0, 180, 0], "default:4": [0, 90, 0], "default:5": [0, 270, 0]},
		"hive": "direction",
		"hopper": {"0": [0, 270, 0], "1": [0, 180, 0], "2": [0, 0, 0], "3": [0, 180, 0], "4": [0, 90, 0], "5": [0, 270, 0]},
		"ladder": {"0": [90, 180, 0], "1": [90, 0, 180], "2": [0, 0, 0], "3": [0, 180, 0], "4": [0, 90, 0], "5": [0, 270, 0]},
		"leaf_litter": "minecraft:cardinal_direction",
		"lectern": "minecraft:cardinal_direction",
		"lever": {"down_east_west": [180, 0, 0], "down_north_south": [0, 270, 180], "up_east_west": [0, 0, 0], "up_north_south": [0, 270, 0], "north": [90, 0, 270], "south": [270, 0, 270], "east": [0, 180, 90], "west": [0, 0, 270]},
		"lightning_rod": {"0": [90, 0, 0], "1": [270, 0, 0], "2": [0, 0, 0], "3": [180, 0, 0], "4": [90, 0, 90], "5": [90, 0, 270]},
		"lit_furnace": "minecraft:cardinal_direction",
		"loom": "direction",
		"melon_stem": {"4": [0, 0, 0], "2": [0, 270, 0], "3": [0, 90, 0], "5": [0, 180, 0]},
		"observer": "minecraft:facing_direction",
		"oxidized_copper_golem_statue": "minecraft:cardinal_direction",
		"piston": {"0": [90, 0, 0], "1": [270, 0, 0], "2": [0, 180, 0], "3": [0, 0, 0], "4": [0, 270, 0], "5": [0, 90, 0]},
		"piston_arm": {"0": [90, 0, 0], "1": [270, 0, 0], "2": [0, 180, 0], "3": [0, 0, 0], "4": [0, 270, 0], "5": [0, 90, 0]},
		"portal_frame": "minecraft:cardinal_direction",
		"pumpkin_stem": {"4": [0, 0, 0], "2": [0, 270, 0], "3": [0, 90, 0], "5": [0, 180, 0]},
		"rail": {"0": [0, 0, 0], "1": [0, 270, 0], "2": [0, 270, 315], "3": [0, 270, 45], "4": [315, 0, 0], "5": [45, 0, 0], "6": [0, 180, 0], "7": [0, 90, 0], "8": [0, 0, 0], "9": [0, 270, 0]},
		"repeater": "minecraft:cardinal_direction",
		"repeater_on": "minecraft:cardinal_direction",
		"repeating_command_block": "facing_direction",
		"shelf": "minecraft:cardinal_direction",
		"shelf_mushroom": "minecraft:cardinal_direction",
		"shulker_box_black": {"0": [180, 0, 0], "1": [0, 0, 0], "2": [90, 0, 0], "3": [270, 0, 0], "4": [0, 0, 270], "5": [0, 0, 90]},
		"shulker_box_blue": {"0": [180, 0, 0], "1": [0, 0, 0], "2": [90, 0, 0], "3": [270, 0, 0], "4": [0, 0, 270], "5": [0, 0, 90]},
		"shulker_box_brown": {"0": [180, 0, 0], "1": [0, 0, 0], "2": [90, 0, 0], "3": [270, 0, 0], "4": [0, 0, 270], "5": [0, 0, 90]},
		"shulker_box_cyan": {"0": [180, 0, 0], "1": [0, 0, 0], "2": [90, 0, 0], "3": [270, 0, 0], "4": [0, 0, 270], "5": [0, 0, 90]},
		"shulker_box_gray": {"0": [180, 0, 0], "1": [0, 0, 0], "2": [90, 0, 0], "3": [270, 0, 0], "4": [0, 0, 270], "5": [0, 0, 90]},
		"shulker_box_green": {"0": [180, 0, 0], "1": [0, 0, 0], "2": [90, 0, 0], "3": [270, 0, 0], "4": [0, 0, 270], "5": [0, 0, 90]},
		"shulker_box_light_blue": {"0": [180, 0, 0], "1": [0, 0, 0], "2": [90, 0, 0], "3": [270, 0, 0], "4": [0, 0, 270], "5": [0, 0, 90]},
		"shulker_box_lime": {"0": [180, 0, 0], "1": [0, 0, 0], "2": [90, 0, 0], "3": [270, 0, 0], "4": [0, 0, 270], "5": [0, 0, 90]},
		"shulker_box_magenta": {"0": [180, 0, 0], "1": [0, 0, 0], "2": [90, 0, 0], "3": [270, 0, 0], "4": [0, 0, 270], "5": [0, 0, 90]},
		"shulker_box_orange": {"0": [180, 0, 0], "1": [0, 0, 0], "2": [90, 0, 0], "3": [270, 0, 0], "4": [0, 0, 270], "5": [0, 0, 90]},
		"shulker_box_pink": {"0": [180, 0, 0], "1": [0, 0, 0], "2": [90, 0, 0], "3": [270, 0, 0], "4": [0, 0, 270], "5": [0, 0, 90]},
		"shulker_box_purple": {"0": [180, 0, 0], "1": [0, 0, 0], "2": [90, 0, 0], "3": [270, 0, 0], "4": [0, 0, 270], "5": [0, 0, 90]},
		"shulker_box_red": {"0": [180, 0, 0], "1": [0, 0, 0], "2": [90, 0, 0], "3": [270, 0, 0], "4": [0, 0, 270], "5": [0, 0, 90]},
		"shulker_box_silver": {"0": [180, 0, 0], "1": [0, 0, 0], "2": [90, 0, 0], "3": [270, 0, 0], "4": [0, 0, 270], "5": [0, 0, 90]},
		"shulker_box_undyed": {"0": [180, 0, 0], "1": [0, 0, 0], "2": [90, 0, 0], "3": [270, 0, 0], "4": [0, 0, 270], "5": [0, 0, 90]},
		"shulker_box_white": {"0": [180, 0, 0], "1": [0, 0, 0], "2": [90, 0, 0], "3": [270, 0, 0], "4": [0, 0, 270], "5": [0, 0, 90]},
		"shulker_box_yellow": {"0": [180, 0, 0], "1": [0, 0, 0], "2": [90, 0, 0], "3": [270, 0, 0], "4": [0, 0, 270], "5": [0, 0, 90]},
		"skull_creeper": {"1": [0, 0, 0], "wall:2": [0, 0, 0], "wall:3": [0, 180, 0], "wall:4": [0, 90, 0], "wall:5": [0, 270, 0]},
		"skull_dragon": {"1": [0, 0, 0], "wall:2": [0, 0, 0], "wall:3": [0, 180, 0], "wall:4": [0, 90, 0], "wall:5": [0, 270, 0]},
		"skull_piglin": {"1": [0, 0, 0], "wall:2": [0, 0, 0], "wall:3": [0, 180, 0], "wall:4": [0, 90, 0], "wall:5": [0, 270, 0]},
		"skull_player": {"1": [0, 0, 0], "wall:2": [0, 0, 0], "wall:3": [0, 180, 0], "wall:4": [0, 90, 0], "wall:5": [0, 270, 0]},
		"skull_skeleton": {"1": [0, 0, 0], "wall:2": [0, 0, 0], "wall:3": [0, 180, 0], "wall:4": [0, 90, 0], "wall:5": [0, 270, 0]},
		"skull_wither": {"1": [0, 0, 0], "wall:2": [0, 0, 0], "wall:3": [0, 180, 0], "wall:4": [0, 90, 0], "wall:5": [0, 270, 0]},
		"skull_zombie": {"1": [0, 0, 0], "wall:2": [0, 0, 0], "wall:3": [0, 180, 0], "wall:4": [0, 90, 0], "wall:5": [0, 270, 0]},
		"small_dripleaf": "minecraft:cardinal_direction",
		"standing_banner": "ground_sign_direction",
		"standing_sign": "ground_sign_direction",
		"sticky_piston": {"0": [90, 0, 0], "1": [270, 0, 0], "2": [0, 180, 0], "3": [0, 0, 0], "4": [0, 270, 0], "5": [0, 90, 0]},
		"sticky_piston_arm": {"0": [90, 0, 0], "1": [270, 0, 0], "2": [0, 180, 0], "3": [0, 0, 0], "4": [0, 270, 0], "5": [0, 90, 0]},
		"stonecutter_block": "minecraft:cardinal_direction",
		"straw_bed": "minecraft:cardinal_direction",
		"torch": {"top": [0, 0, 0], "west": [0, 0, 0], "south": [0, 90, 0], "east": [0, 180, 0], "north": [0, 270, 0]},
		"trapdoor": "weirdo_direction",
		"tree": {"x": [0, 0, 270], "y": [0, 0, 0], "z": [90, 0, 0]},
		"tripwire_hook": "direction",
		"vault": "minecraft:cardinal_direction",
		"wall_banner": {"2": [0, 0, 0], "3": [0, 180, 0], "4": [0, 90, 0], "5": [0, 270, 0]},
		"wall_sign": {"0": [0, 180, 0], "1": [0, 180, 0], "2": [0, 0, 0], "3": [0, 180, 0], "4": [0, 90, 0], "5": [0, 270, 0]},
		"weathered_copper_golem_statue": "minecraft:cardinal_direction"
	}
}
